0,그리 맵지 않음,3.0
1,이사오기전 회사 앞이라 가끔 갔는데 먹기도 힘들지만 난 화장실도 힘들었던 ㅋㅋ  근데 여자들이 너~~무 많~~다 ~~ 이 어려운 음식을 ㅋㅋ,1.0
2,최악의 냉면집...소고기다시다랑 멸치다시다 조합한 맛의 싸구려육수에 암튼 걍 싸구려 냉면이지요..포장해서 집에서 먹다가 머리카락이 하나 나오길래 그럴수 있지하고 더먹는데 무더기로 계속 나와서 기분더러워 먹다버렸네요. 포장용기에 머리카락 몇개 주워서 들고 다시 가게가서 사람 많길래 장사방해될까 싶어 조용히 카운터에 얘기했더니...냉면 먹고 오리발 내미는 사람취급..발견했을때 바로 전화해서 자기한테 확인받고 남은 냉면 다시 다 가져와야 한다네요ㅜㅜ 증거가 어딨냐고  하네요...기분 개떡같아서 따졌더니 그제서야 억울하다는듯 걍 환불해준다고 하길래 거부하고 나왔네요..집에 와서 음식물쓰레기통에 버렸던 냉면 주워담아서 다시 가져다주고 왔습니다. 머리카락은 제가 보관하구요...당장 송파구청에 정기적인 위생검사 신청할거구요...담당공무원님 제대로 안하시면 다른루트로 제대로 검사받게 할겁니다. 장사잘된다고 기본적인 서비스마인드도 없고 위생도 개떡같은 이런 음식점은 사라져야 합니다.,1.0
3,음식맛이 일품이네요,5.0
4,5년넘게 애용하고있는 냉면맛집이에요~ 눈물콧물 쫙 나와도 불타는 맛 중독에 헤어나오질못하고있답니다 ㅎ 양념을 취향껏 넣어먹을수있게 테이블에놓여져있는데 정말 양조절해야되요..큰코다칠수도..,3.0
5,딱히 왜 맛있는지 모르겠어요ㅠㅠ엄마가 좋아하셔서 몇번 가긴 했지만..,1.0
6,김밥집 냉면이200배는 맛있음,1.0
7,가격이 저렴해서 좋았습니다 매운다대기도 취향것 넣어먹을수 있어 좋았습니다,3.0
8,그냥 물냉에 다대기 풀어서 먹는게 제일 맛있어요ㅎㅎ 저도 비냉도전해보려다가 도저히 용기가 안나서….,5.0
9,맛있게먹고 면도 생면으로 포장가능해서 싸왔음~~ 집에서 또해먹어야지~ ㅋㅋ,3.0
10,비냉과물냉두개시켜먹었는데 양념이 맵더라구요 맛은있는데 양념이 몬가 깊은양념맛은 아닌듯 … ㅎㅎ,5.0
11,양이 되게많았어여~ 다먹으니 배가 완전 빵빵,4.0
12,음식이 금방나와서 너무좋았어요 따로 비치되어있는 그 양념장 제가 맵기를 조절해서 먹을수있어 좋았어요!!!!,3.0
13,요기 양념장 완전 맛잇어요!! 엄청넣어먹었네요!! 매운양념이니 넣고먹어보고 조절해야될거에요!!,3.0
14,맛있게 먹는법을 따로 적어놓으셨더라구요 따라해먹으니 맛있었습니다.,3.0
15,맛없다고욕하는사람들이해안되요 미친듯이매운곳인데뭐 ㅋㅋ맛이아니라아프러오는곳 ㅋ스트레스풀러와요가끔ㅋㅋㅋㅋ,4.0
16,보통 맛집들은 가격이 비싼데 요집은 가격도 착해요 착해~ㅋㅋ,5.0
17,입구에있는 육수 너무맛있어요ㅜㅜ 육수가 또생각날듯한 그런맛!! 매운거 좋아하시는분들 비냉도전해보세요~ 매워요 ㅋㅋ,4.0
18,성인남성이 먹어도 거뜬한 양ㅋ 물냉이 좀 밍밍한거같은데 테이블에있는 양념장넣어먹음 굳ㅋ,3.0
19,물냉은 특별하진않았구 비냉이 추천추천!! 물냉에 다대기넣어서 먹음 진짜 그것도 추천추천!!,5.0
20,매운거못드시는분은 물냉 매운거좋아하시는분들은 비냉!! 매운거못드시는데 비냉드시고싶음 육수넣어달라고하심 덜매워요~!!,3.0
21,음식은 물냉.비냉 두개밖에없어요 줄도 길어서 대화할시간도없이 금방먹고 빠져줘야해 근데 일부러아니야…비냉먹으면정신없어서 먹고빨리나오게되,3.0
22,비냉 진짜매운데 그래도 계속 입으로 넣게되요오~ 매울때 육수한컵 딱!! 크으~,5.0
23,매운거 잘못먹어서 물냉시키고 앞에놓인 소스 살짝풀어 먹으니 맛있었어용~ 양도많아용,3.0
24,저는 매운걸 좋아해서 양념장 더추가해서 먹었네요~ 맛있네요~,5.0
25,난 가면항상 물냉만먹어요ㅋㅋ 불친절하다고뭐라하는사람들 이해안됨ㅋ 손님그렇게많은데 정신없으시겠지뭘,3.0
26,난 매운걸잘먹지만 여기는 진짜매움 앵간히 못먹으면 시도도하지마시오ㅋ걍물냉추천,5.0
27,뜨거운육수는 필수로 떠다먹어야하는것 비냉먹다보면 입에 감각이 사라지는매움ㅠㅠ 근데…또먹고싶어져 이상해…,3.0
28,웨이팅해도 금방금방빠짐 자리도그냥 모르는사람옆에서먹는데 정신없이 먹고 금방나감ㅋ,3.0
29,난 못먹는데 매운걸좋아하는데 여기는 그냥심하게아픈맛인데 근데 또가고싶은데??잉?,5.0
30,난 물냉먹으러오는데 비냉먹으러오는사람들보면 대단ㅋㅋㅋ,4.0
31,비냉먹고 화장실 엄청갔음ㅋㅋㅋ다음엔 물냉을 먹을께요ㅎㅎ,3.0
32,"So so...가격은 ₩4,500 으로 인상 밤12시까지 연장 영업으로 변경...",3.5
33,저 매운거 잘먹는데 비냉 머리아프고 정신빠지게 맵네요ㅠㅠ꼭 덜맵게 해달라고 하시고 육수좀 넣어드시는게 좋겠습니당..그리고 희한하게 물냉이 아무것도 안넣었을때 뭔가 평양냉면스런 맛이 있어서 좋았음,4.0
34,핵폭탄 매운 냉면집! 정말 매워요! 스트레스가 한반에 훅,5.0
35,냉면의 본좌! 물냉먹는사람은 바보에요~마늘맛 톡 쏘는 비냉과 육수는 지상최고!!,4.0
36,매운비빔냉면♥맛점하세용!!,4.0
37,"2013년 12월 2일부로 500원 인상되서 물냉면/비빔냉면 4,500원으로 바뀝니다",3.5
38,4500원으로 인상됨,3.5
39,오늘 점심 매운 해주냉면으로....,4.0
40,매운음식이땡기는날 무자게먹고싶은집,4.0
41,정말 맛있어요,4.0
42,매운맛이끝내줘요 엄청 맛있어  국물이끝내줘요,4.0
43,맛집이라기엔 형편없는 솜씨. 개인적으론 신천 메인골목의 별미냉면집이 훨 낫네요.,4.0
44,비냉 너무 맵지만 갈때마다 도전해요 ㅋㅋ,4.0
45,먹을만했구요,4.0
46,매주 주일은 쉽니다. 오전 11:30분~오후 9시까지 영업.,4.0
47,육수넣은 비냉도 엄청 매움. 매운 거 못먹는 사람은 물냉추천~ㅋ,3.5
48,진짜 매우 엄청 매워요... 매운거 못드시는 분은 물냉면 먹으라는 팁들을 꼭 따르시길. 그래도 혹시나 해서 비빔냉면 시켰다가 정신이 혼미해지는 경험을 했어요 @_@,3.5
49,이집냉면 겁나먀워요,4.0
50,비빔냉면 좀 들 맵게 먹는방법-육수넣은 비빔을 시켜서 설탕 한스픈 반 쫌 안되게 넣어 먹음 그나마 쫌 들맵습니당.,4.0
51,가격이 아직도 4000원,3.5
52,뭐 이쯤이야 기본...맛있게 먹을 정도의 매운맛 ..근데 다흔 손님들 울고 있음 땀이 폭포수임  왜?,3.5
53,매운가좋아하는사람으로써엽떡보다덜매움. 게다가맛도별로... 하아...,4.0
54,물냉면 여러모로 깔끔했던 것 같아요,4.0
55,매운 맛 좋아하는 나 이지만 오로지 매운 맛만 으로는 내 입맛을 사로잡긴... 정말 매운맛이 사무칠땐 좋을듯,4.0
56,완전조아 ㅋ,4.0
57,냉면 4000원으로 인상!,3.5
58,난 비냉 너무매워서 항상 물냉먹음ㅋ,3.5
59,완전 매력매력 :-),4.0
60,난여기냉면매워,4.0
61,NOT BAD,4.0
62,멀리서 와서 먹을정도까진 아닌데 동네주민인 저는 종종 갈듯!,3.0
63,언제부터인가 포장도 가능합니다,3.5
64,어릴 때는 가끔 먹었는데 먹어본지 10년 넘은 것 같네요. 매운 맛이 일품이었는데 너무 매워서 싫다는 사람고 많았죠,3.5
65,비빔냉면 3500 물냉면 3500 사리 1000 비냉 너무 맵다 하시는분은 육수넣은 비냉 추천합니다.,4.0
66,매운거 잘 못드시는 분은 육수 넣은 비빕냉면 드셔도 됩니다.,4.0
