0,저렴한 평범한 김밥들도 있었는데 이왕 프리미엄김밥짐까지 찾아간거 좀 비싼것들로 먹어봤습니다. 매콤견과류김밥 김치더블치즈김밥으로 먹었는데 매콤견과류는 워낙 유명해서 맛있는건 다 아실거고 김치더블치즈가 의외로 맛있더군요. 김치랑 치즈의 조화가 생각보다 맛있어서 놀랐습니다.,3.5
1,떡볶이도 김밥 못지않게 맛있다는 정보를 입수해서 먹어보러다녀왔어요~! 혼자서 먹고오기엔 민망해서 친구 데리고 갔는데 가격도 부담스럽지 않아서 제가 한 턱 쏘고왔네요~! 친구도 맛있다고 2줄이나 집에 싸가더라구요. 완전 만족스러워요~!,3.5
2,김밥은 시간 없을때 먹는 싼 음식이다라는 편견을 깨준 곳이에요. 회사가 근처라 점심시간에 동료들이랑 종종 오는데 그때마다 사장님께서 친절하게 싸주셔서 음식에 더 믿음이 가기도 하구요. 속재료가 워낙 맛있어서 김밥맛은 두말할 나위 없네요.,3.0
3,다른데서 불고기김밥 먹으면 정말 고기 넣은거 생색내려시는 듯 조금만 넣어주시던데 여기는 불고기 항상 듬뿍듬뿍 넣어주셔서 고기가 김밥의 반이라고 해도 과언이 아닐 정도라 마음에 들더군요ㅋ 불고기김치로 먹었는데 그냥 일반 밥 한끼 먹은거랑 다름 없었어요ㅋ,3.0
4,아무래도 옛날에 비해서는 속재료가 약간 줄어든것 같다는 느낌을 피할 순 없었지만 그래도 여전히 다른 김밥집들에 비해서 제일 맛있어용. 특히 참치김밥은 마요네즈 소스가 듬뿍들어가있어서 씹을 수록 맛있으니 여기 가게되시면 참치김밥 꼭 드셔보세용.,3.0
5,"요즘 프리미엄 김밥집 많이 생겼지만 전 그래도 아직까지 여기 김밥이 제일 맛있네요 ㅋ,ㅋ 특히 매콤견과류 김밥은 정말 안 먹어본 사람은 그 감동을 모를꺼에요 얼마나 맛있는지 ㅋ,ㅋ 견과류가 밥이랑 잘 어울릴수도 있다는걸 여기서 꺠달았어요ㅋ,ㅋ",3.0
6,2층 생기면서 손님들이 더 많아졌더라구요..예전에 가게 엄청 작았을때부터 다녔던 단골로써는 너무 유명해져서 기다리는 시간이 많아진게 아쉬울 정도에요.. 저는 여기 불고기 김밥 좋아하는데 불고기가 엄청 많이 들어있어서 든든하과 좋더라구요..,3.5
7,보통 김밥사면 속재료보다 밥이 더 많은게 대부분이었는데 여긴 밥이 너무 얇게 들어있어서 문제^^ 그만큼 속재료가 알차고 꽉꽉들어있어서 두께도 엄청 두꺼움. 한 개 입에넣으면 입 안에 꽉 찰 정도로 커서 김밥 한 줄만 먹어도 엄청 배부른 집.,3.0
8,김밥 한줄 가격이 보통 김밥천국에서 한끼?정도하는 가격이더라구요~ 하지만 들어가있는 원재료나 영양소같은 면을 생각해봤을 땐 아무래도 이런 프리미엄김밥이 훨씬 더 나을 것 같아요~ 인기 많은 김밥들은 반반으로도 팔고있어서 더 좋았어요~,3.5
9,김밥이랑 같이 먹으려고 떡볶이도 주문했었어요ㅎㅎ 매콤함 보다는 달달함이 더 많이 느껴지는 떡볶이였는데 떡 크기도 적당하고 오뎅도 쫄깃쫄깃한 오뎅이어서 맛있게 먹고왔네요ㅎㅎ 특히 떡볶이 국물이랑 김밥이 잘 어울렸어요ㅎㅎ,4.0
10,일단 너무 매장이 깔끔하고 파프리카김밥이랑 무슨소스를주는데 같이 먹으면 완전건강식에 칼로리걱정도없고 월남쌈 먹는기분이고 에담치즈김밥도 너무 맛있습니다.다이어트하는분들은 야채많은김밥드셔도 될듯,5.0
11,종류가 너무 많아서 뭐로 먹을지 고민하다 결국엔 젤 기본인 참치김밥으로 먹고왔는데 아직까지 다른거 먹을걸 후회하고있어요! 인터넷보니 특이한걸로 많이 드시던데 저도 다음에 다른거 먹어보러 또 방문하려구요!,4.0
12,버섯 파프리카 에담치즈 리김밥  추천할만했음,4.0
13,딱봐도 건강해보이는 김밥들 종류가 정말 다양해서 뭘 먹을지 들어서자마자부터 고민됬어요. 저는 먹고가려고 2층에서 앉아서 먹고왔는데 2층도 깔끔하면서 아기저기 잘 꾸며져 있어서 김밥집 같지 않게 세련된 공간에서 먹을 수 있어서 좋았네요.,4.0
14,여기 매콤견과류 김밥이 맛있다길래 먹어봤어요~ 무엇보다 재료들이 푸짐하게 들어있어서 맛이 없으려해도 없을 수가 없는 맛이더라구요~ 재료들이 좋아서 그런지 뒷맛도 입에 남는 느낌 없이 깔끔한 느낌이어서 더 좋았어요~,3.0
15,원래 압구정에만 있었는데 최근에 가로수길에 분점을 내셨다고 하더라구요~불고기 김밥 괜찮았어요ㅎㅎ,5.0
16,가성비 괜찮은 김밥집 중 하나에요. 5만원 이상주문하면 배달도 해주니 편리해요.,4.0
17,예전에 볼일보러 들렸다가 점심먹을 시간이 부족해서 이곳에서 김밥하나 사먹었었는데 진짜 맛있어서 이젠 일부러 찾아가는 김밥집!~,5.0
18,요즘 김밥 메뉴들이 다 똑같아서 어느순간 김밥을 잘 안먹었었는데 여기는 종류가 다양해서 좋았네요.,3.0
19,김밥 반반이 주문되는 경이로운 곳!! 좀 비싸긴 해도 그만큼 맛있음!!,5.0
20,"요즘 다이어트중이라 버섯파프리카 김밥 먹었어용 @,@ 독특한 메뉴들이 많아서 추천해용",3.0
21,정말 프리미엄 김밥의 원조라고 할 수 있는 집~가격도 나름 합리적인듯~ㅎㅎ,4.0
22,생각보다 김밥들 가격이 비싸지도 않고..특이한 메뉴들이 많아서 좋았어요..,5.0
23,김밥에 재료를 아끼지 않고 넣어주시는게 눈에 보이니 더 좋네요ㅎㅎ,5.0
24,견과류 들어간 김밥은 이곳에서 처음 먹어봤어요~매콤견과류 김밥 강추해요~ㅎㅎ,5.0
25,김밥집 답지 않게 안에서 맥주고 파시더라구요^^가볍게 한끼 먹기에 좋았어요,3.0
26,김밥이 다른곳보다 확실히 맛은 더 있었네요^^ㅋ 재료도 많이 들어있었어요.,4.0
27,밥보다 재료가 더 많이 들어있는 것 같아요 돈아깝다는 생각은 안드네요~ㅋㅋ,4.0
28,참치김밥이 정말 대박입니다ㅎㅎ 김밥에 참치가 흘러내릴 정도로 넣어주세요ㅎ,4.0
