0,테라스자리는 와인 필수 주문인데,4.0
1, 9900 원 짜리 와인을 59000 에,3.2
2, 3만원짜리 와인을 22 만원에 판매. 그렇다고 안주가 저렴한것도 아님,3.9
3,맛있는 음식에 전망도 좋은데 음식 양이 너무 적어요 ㅠ,4.6
4,너무너무 추운게 단점인것 말고는 음식맛은 진짜 최고인 것 같아요!!분위기도 좋은데 음식 양도 생각보다 넉넉하고 뭐가 최고랄 것없이 세가지 시킨메뉴 전부 너무 맛있어용,3.8
5,저녁에 갔으면 더 예뻤을 것 같긴 해요.낮에 갔는데 유리나 테이블,5.0
6, 잔이 깨끗하지 않더라고요. 가벽처럼 유리가 가로지르는 곳이 있는데 거기 지문이 막 있는 그런 더러움 정도…?테이블 간 간격도 좁아서 사람 많을 때 엄청 시끄러울 것 같아요.,5.0
7,맛있어요 ㅎㅎ,4.9
8,재벌집 막내아들 방영해서 방문했어요 ㅎㅎ정말 분위기가 좋네요 ㅎ인테리어가 정말 세련되고 멋지네요 인생사진 마니 건져갑니다 ㅎㅎ그리고 직원들도 친절해서 대접받는 기분이라 정말 기분좋게 다녀감니다 ㅎ아 그리고 음식도 정말 맛있고 훌륭함,4.8
9,특별한 날에 오기 진짜 좋은 곳 발견 했네요 ㅎㅎ전 인스타 보고 방문 했는데 역시!!친구 픽이 좋긴 좋나봐요~~,5.0
10,모임 때문에 이번에 대관 했던 곳이었는데 확실히 커플 분들이 오셔서 데이트 하기에도 좋은 코스요리가 많아서 좋네요 ㅎㅎ 사진 찍기도 너무 좋고요 가실 분들 무조건 가보세요 ㅎㅎㅎ,4.9
11,재벌집 막내아들에 나왔다해서 가봤는데 분위기 좋고 음식도 맛있었어용!ㅋㅋㅋ투움바 파스타 추천합니당~~!,4.8
12,야경이 멋지고 주차가 편리해서 여기는 무조건 재방문 할 생각 이써요 ㅎㅎ재벌집 막내아들 방영해서 방문 했는데..역시 찐이네요~,4.9
13,뷰만 맛집 인줄 알았는데.. ㅎㅎ 음식까지 맛집이어서 엄청 놀랬어요 ㅋㅋㅋ인테리어도 깔끔하고 사진도 이쁘게 나오더라고요,4.8
14,특별한 날에 분위기 있게 드시고 싶으시면 메리가든 추천 드려요 ㅎㅎ저도 블로그 보고 방문 했는데 생각 보다 더 퀄리티 높은 음식 먹고제대로 놀고 온거 같아서 기분이 좋네요!!!,4.8
15,데이트 맛집 찾으시는 분들이라면 무조건 여기가서 먹방 찍으시면 좋을거 같아요 ㅋㅋㅋ진짜 커플 분들 많으시고 뷰 맛집 인정합니다!!,5.0
16,음식 너무 고급지고 맛있었어요! 저녁에 방문했는데 야경도 너무 이쁘고 주차도 편리하게 되어있어서 재방문 의사 있습니다! 사진도 이쁘게 나와서 꼭 다시 방문할려구요!,3.8
17,최근 방문했던 레스토랑중에 제일 맛도 괜찮고 분위기도 괜찮았던 집이라서 리뷰 남겨요기념일에 방문했는데 직원들도 너무 친절하게 안내해줘서 좋았고,3.0
18, 야경이 진짜 너무 예뻤어요메뉴도 다양해서 고르는재미와 맛보는 재미도 있습니다,4.1
19,분노를 느끼고 싶으면 가세요. 한시간 기다리고 주문 취소하고 나왔습니다. 사실 나는 백종원 골목식당 테스트유저로 참여하고 있는거 아닐까? 그게 아니라면 이 상황을 어떻게 이해하지 싶은 1시간이었습니다. 알바들은 착해요. 근데 벨을 눌러도 안오고 콜라도 안나오고 음식들이 갈 곳을 잃고 바 앞에 식어가고 있었습니다. 도심 야경은 예쁩니다. 음료..정도 시키면 괜찮을 것 같습니다.,3.4
20,강남 한복판에 이런 곳은 처음 봄1.예약하고 가서 창가자리 안내해줌. 주류 필수주문인데(공지해주세요),2.6
21, 술을 못마셔서 그냥 다른 자리 앉겠다 했음. 그냥 안내하면 되는데 알바생 ‘논알콜도 안되시는거에요?’한마디 말투가ㅋㅋㅋ대학교 술집 알바생들같이 어리버리하고 서비스가 별로임2.난잡한 인테리어. 높이가 맞지 않는 테이블들.. 손님 테이블 바로 옆에 있는 사다리..공중에 떠있는 난방기ㅋㅋㅋ통창뷰 말고는 인테리어가 예쁜건 절대아님. 데이트? 소개팅? 비추입니다3.음식도 가격대비 별로.. 카페음료 메뉴도 맛없어요..4.결정적으로 사장님이 요식업에 조예가 깊어서 직접 조리하시면서 운영하시는 그런 음식점은 아닌거같아요. 손님들 있는데 왔다갔다..약간 감시?하시듯이 카운터쪽에서 막 계~~속 둘러보시고..알바생들 얼어있고..무서워요...직접 관리하실거면 유니폼이라도 같이 입으시던가 아니면 서비스 경력 많은 홀매니저를 따로 두세요백종원 선생님이 오시면 지적할 게 한무더기 나올 곳임이런거에 되게 무딘 편인데도 별로였음..친구랑 나오면서 약간 지방에 있는 대학교 앞 술집같다고 생각함...,3.7
22,평점알바,3.5
23,주차비 5천원있음. 기념일이라 뷰좋은곳으로 가긴 했는데.. 파스타 나오는데 30분 넘게 걸린듯 ㅠㅠ 아마 주문이 안들어갔던것 같음 ^^...,4.1
24,뷰가 좋아서 인기가 많으나 음식 퀄리티니 매장 청결도는 가격에 미치지 못함,3.8
25,창가 자리 너무 좁고 더워요...,3.6
26,지인들이랑 일찍이 미리 예약해놓고 스케줄 다 짜고 좋은 장소가 될거라고 기대했는데 당일 전날 취소 통보는 많이 당황스럽네요..^^ '취소 안하셔도 되는데 대화가 불가능할 정도로 시끄러우실거다'라는 말을 들으면 당연히 취소할수밖에 없지 않을까요 손님 예약이 있는날 단체 대관을 받으신거면 이미 예약한 손님용 자리는 따로 마련해준다던지 그런 대처였으면 충분히 더 좋았을것 같습니다...ㅎ,4.7
27,주차하기 편하고 뷰 맛집입니다음식은 양은 좀 적은데 맛은 꽤 좋았어요,4.0
28,맛 필요없고 분위기만 본다 하시면 괜찮아요. 커피나 와인 한 잔 하기에도 괜찮겠어요. 해질녘 뷰가 참 좋더라고요. 메뉴는 플레이팅만 그럴듯하지 맛은 별로에요 :),3.9
29,맛있었어요! 근데 같이 간 사람은 느끼하다고 하네요. 뷰 정말 좋아요,4.5
30,"맛은 좋아요 시킨 메뉴들은 다 맛있엇는데 발렛파킹 하지도않았고 주차만 했는데 지도앱 정보란에는 발렛파킹제외 주차만 하는건 무료라고 명시해놓았으면서 ""1시간에 8000원을 도장찍어서 5000원으로 할인시켜준거다""라고 주차 담당자가 말을 바꿔버리네요ㅋㅋ 막말도 남발하시고 맛있게 먹은 음식으로 기분좋았는데 관리원 한명 때문에 기분 안좋아졌네요",4.0
31,직원분들도 친절하시고 분위기도 좋고!만족입니다 ㅎㅎ,5.0
32,분위기 내기 너무 좋네요~~!! 맛있게먹고왔어요^^,5.0
33,너무 맛있게 잘먹었어요! 분위기도 넘 좋고 특별한날 가기 좋네용!!!,5.0
34,잘 먹고 왔습니다.서빙  ,5.0
35, 분위기  모두 좋았습니다.,4.5
36,뷰 끝내주는 곳에서 즐거운 식사가능한곳 서빙과 음식맛은 당연히 좋구요 이퀄리티에 이정도 가격이면 가성비 갑입니다,4.8
37,고급진곳에세 즐겁고 맛있는 식사를 하시고 싶으시다면 정말로 추천합니다.,5.0
38,뷰가 정말 좋아요 디저트도 넘 맛있게 먹었어요~~,4.9
39,브런치  좋네요.가격은  좀  비싼면이 있습니다.하지만  서비스가  좋으니  괜찮습니다.,4.9
40,분위기 최고였어요 ㅎㅎ 와인도 맛있었고샐러드랑 봉골레파스타 맛집입니다 정말 잘 먹었어요!,1.2
41,이래서 역시 네이버 평점은 믿을게 못된다..,3.7
42,안심 스테이크 65000  원짜리ᆢ놀래서 이게 다냐고 다시한번 물어봄 ㅋㅋ이건 뭐 키즈 가정식 도 아니고조리사 없이 서빙 알바가 다 하는듯 ᆢ접시라도 스테이크 접시 쓰시지 무슨 서비스 주신줄ᆢ그냥 두점 입넣고 끝 ᆢ맛이라도 있으면 ㅜㅜ그것도 호주산 ㅋ남친 생일이라 예약했다가 뷰고 나발이고 그냥 개망신ㅜㅜ남친 계속  웃기만함 ㅡㅡ;;커피만 마시러 가세요어이없어 콜라마시고 나가는데 콜라도 5000 원나가서도 발렛파킹 5000 원 ㅋㅋ호구당하고옴,5.0
43,오로지 뷰 맛집. 음식 나오는 시간 길고 계단 입구에서 종업원들이 길 막고 지들끼리 이야기함 손님인줄?노래소리도 너무 커서 이야기하기가 힘듦.봉골레는 해감 덜 됨. 스테이크는 미디엄이 아니라 미디엄웰~웰던급으로 나옴.다시 말하지만 오로지 뷰 맛집임.,4.5
44,입구에 사람 없고 서있는데 직원들이 보고도 안내 안해줌 예약하고 갔는데도 십분 기다리고 안내받음 처음 일하는 사람들 마냥 어리바리 그자체 공간 자체는 좋은데 사장님인지 매니전지 다른직원들에게 욕하며 반말..혼낼 일 있더라도 손님 없는곳에서 하셔야지 한가운데서 직원들 대여섯명 다 모아서 한소리하심 기본이 안된듯..다 들려서 내가 다 기분 나쁘고 분위기 다 망침 두번은 안갈듯,3.0
45,디저트 값이 비싸긴한데뷰도 이쁘고 디저트 맛있었음,4.4
46,이런 식으로 장사할 거면 그냥 장사를 하지 마세요  저녁 5시 이후에는 음료와 디저트 주문이 불가능하고 메뉴판에 있는 음식을 반드시 시켜야 한다는 중대한 원칙이 있으면 미리 네이버 가게 정보에 명시를 하든지 최소한 예약할 때라도 말해줘야 하지 않나요? 그런 원칙에 대해서 어떤 정보도 명시해놓지 않고 예약은 받고 막상 가서 주문하니까 그 때 되서야 말하네요 바쁜 친구와 겨우 시간 맞춰서 많이 찾아보고 어렵게 결정해서 온 건데 덕분에 소중한 저녁 시간을 다 망쳤네요 이미 다른 루프탑도 다 만석이라 못 들어갔어요 뷰 값 받으려는 것 이해하고 메뉴 의무 주문도 이해합니다 다만 왜 그걸  명시하지 않고 마치 저녁에도 차와 디저트를 먹을 수 있는 것처럼 소비자를 낚냐는 겁니다 막상 가면 이왕 왔으니 어쩔 수 없이 방침에 따라 음식을 주문할 거라 생각하나보죠? 이런 식으로 장사하지 마세요. 너무 불쾌해서 다시는 가고 싶지 않은 곳이네요(노쇼 방지를 위해 예약금 만원 받는 것도 너무 웃겨요 이런 곳 처음 봅니다 손님의 도리는 그렇게 강조하면서 정작 본인들은 꼭 알아야 할 정보 제공도 안 하고 손님 낚을 생각이나 하네요.),2.4
47,저녁늦은시간 구석자리만 남았길래 가볍게 칵테일한잔 하고 가려고 하니 메뉴시키라고 닥달 자리는 비좁은데 테이블간격도 좁아서 무슨 더블데이트 하는줄.. 다시 가고 싶지 않음...,3.0
48,딸기생크림크로와상 존맛,4.9
49,시티뷰 보면서 먹는 브런치 쵝오,4.9
50,데이트하기 좋은 카페,4.9
51,데이트나 소개팅 하기 좋을 것 같네요,5.0
52,창가자리 인기 폭발 뷰가 좋아서 인정~~!,4.9
53,천장 높고 분위기 좋음,4.9
54,루프탑카페 완전 추천이요~!,5.0
55,들어가서부터 사진 왕창 찍고싶은 비주얼 ㅎㅎㅎ,4.9
56,언제 와도 뷰가 예뻐요,4.9
57,데이트 코스로 오기 좋아요.,4.9
58,야경이... 미쳤어요.... 완전 인생샷.... ㅠㅜㅜㅜㅜ 넘 이뻐요!!!!!ㅜㅜ,4.9
59,가격대는 있는데 이런 뷰라면 올만 하다고 생각함,4.9
60,노을 지는거 보고 있으니까 좋더라구요,4.9
61,간단하게 먹고 크로플 먹는게 행복임 ㅜ,4.9
62,루프탑이고 통유리로 뻥 뚫려있어서 그냥 밖에만 바라보고 있어도 힐링~~,4.9
63,갈 때 마다 여유 그 자체 ~~ㅎㅎ,4.9
64,크로플이 넘 맛있었어요 ㅎㅎ,4.9
65,시티뷰 맛집 ㅜㅜㅜ 분위기 넘 좋고 인생샷 건지고 가용 ㅠㅠ,4.9
66,햇살 받으면서 루프탑에서 먹는 브런치란,4.9
69, 소확행,4.8
70,젤 좋아하는 분위기라 엄청 자주 오는 카페 ㅎㅎ,4.9
71,인생샷 왕창 찍고 갑니당 분위기 완전 좋아효 ㅜㅜ,4.9
72,야경 즐기기도 최고ㅜㅜ 날씨 좋아지면 사람 더 많아지겠지..?,4.9
73,브런치 즐기기 넘 좋은 카페~~,4.9
74,딱 노을 질 때 쯤 가면 뷰가 진짜 미쳤음. 진자 진심 리뷰 잘 안다는데 다들 꼭 봤으면 좋겠어서 리뷰 다는거임..,4.9
75,딸기 크로와상에 딸기 라떼까지 행복 그자체,5.0
76,데이트하기 분위기가 딱 좋음,5.0
77,뷰가,4.9
79, 진심 미쳤다,5.0
80,인생카페여,5.0
84, 음식이 너무 이쁘게 생겼어요 ㅎㅎ,5.0
85,뷰가 참 좋네요,5.0
86,이런 브런치집 왜 없나 했는데 요기있었넹ㅜㅜ 분위기 미쳤어요 ㅜㅜㅜ,5.0
87,좋다는 후기 반,5.0
88, 나쁘다는 후기 반 있어서 반신반의하고 갔는데... 정말 연휴 때 기분 망칠 뻔 하다가 여차저차 잘 보내고 왔습니다.기분이 좋지 않았던 이유:1. 직원들의 서비스... 일반 음식점보다 못 해요.직원들이 싹수가 없고 그런 것은 정말 아니에요. 하지만,2.3
89, 교육이 제대로 안 되어 있는지 정말 어리벙벙,5.0
90, 벨이 고장나서 필요하시면 불러달라는 멘트 하시다가 필요하시면 연락주@#%@!.. 라는 쌩뚱맞게 말하다 갑자시 가 버리시고. 호텔 레스토랑이라고 하기에는 너무 제각각 입고 있는 옷... 요즘은 일반 음식점도 유니폼이 있는데요...2. 샐러드 하나 나오는데 30분 기다렸습니다. 코스요리라고 하면,5.0
91, 한 음식을 다 먹었을 때 다음 음식이 나와야 하는데 샐러드 다 먹고 두 번째 음식 나올 때 까지도 한참 기다렸어요. 특히,1.0
92, 9시에는 문을 닫아여 해서 시간이 촉박했는데,5.0
93, 참고 참다가 이 과정에서 순간 너무 짜증니 났습니다. 세 번째 음식 부터는 음식을 다 먹지도 않았는데 다음 요리가 계속 나오더군요. 좁은 테이블에 앉았으면,3.1
94, 이 또한 문제가 됐겠네요. 스테이크가 너무 빨리 나와 식어버려서 질겨서 많이 먹지 못 했습니다.3. 직원들끼리 커뮤니케이션이 안 되는지,5.0
95, 서로 음식을 나가면서 이건 어디 테이블이냐,5.0
96, 저기는 왜 안 나갔냐,5.0
97, 하면서 서로 모른다는 표정으로 일관. 손님 테이블에 음식이 안 나갔으면 좀 걸리더라도 다시 한 번 정확히 확인하고 나가는게 맞는데,5.0
98, 모르겠다 하면서 일단 빈 테이블에 샐러드를 밀어넣음... 기가 막혔습니다.4. 저는 흡연자라 괜찮은데... 레스토랑,2.7
99, 그것도 호텔 레스토랑 안에 흡연실 있는것도 참 희한하고 웃겼습니다 허허...그럼에도 불구하고 장점:1. 일단 분위기는 좋아요. 생각했던 것 보다 내부가 작지만,3.6
100, 음악 소리도 크고 (호불호 갈릴듯),4.9
