0,무난하게 가기 좋은 술집~! 분위기 좋아서 종종 가요 🙌🏻,3.6
1,들어가서 대기인 입력하고 입구에서 뻘쭘하게 서있는데 직원분들이 계속 본체만체했어요. 한 5~10분 기다리니까 그제서야 말거는데 서비스가 너무 별로여서 그냥 나왔어요ㅠ,3.5
2,직원이 다소 불친절함육회물회 냉동육회 사용으로 종이를 씹는 식감막걸리는 달달하게 맛있지만 술먹는 느낌이 안남,3.7
3,카운터에 계셨던 남자 나이 좀 있으신 남자분 정말 화나네요. 방문했을 때 웨이팅 앞에 한분 계셨는데 저희 도착하자마자 들어가셨고 그때부터 25분정도 매장에서 계속 대기했습니다. 다음 분들 많이 오셔서 매장이 조금 소란스럽고 복잡하고 더웠지만 과일 막걸리 먹고싶어서 참고 기다렸는데 갑자기 다음 팀을 먼저 부르시길래 왜 저희 번호 안부르시냐 했더니 몇번이나 불렀다고 말하셨습니다. 정말 어이없고 당황스러웠어요. 네명이서 그 안에서 계속 기다리면서 부르는 걸 못 들었을 리 만무하고 설령 부르셨더라도 저희 넷 다 못들을 정도였으면 직원분에게 문제가 있는 걸텐데 그렇게 한마디하고 나서부터는 말 걸어도 다 무시하시고 진상 고객인 것처럼 응대하셔서 기분만 망쳤네요.. 시간도 아깝고 화나요. 다신 안갑니다,3.0
4,술과 음식은 괜찮지만 양에 비해 너무 비싸고 직원분들이 너무 삭바가지가 없슴… 안내도 설렁설렁,3.9
5,자두막걸리 하도 추천해서 마셔봤는데 겁나맛있네요 딸바는 좀 무거운 느낌이고 자두청포도는 가볍고.. 완전달아요 닭똥집이랑 오뎅탕도 맛있었어요,3.4
6,막걸리 종류 많아요자두 막걸리 맛있음좌석 좁고 시끄러워요음식들도 쏘쏘 평타,3.0
7,스팸두부김치만 맛있었어요연어는 맛있지만 진짜 창렬…굳이 또 가고싶지 않아요..,5.0
8,나쁘지 않아용,3.6
9,알바 디꺼움,3.9
10,불친절,4.1
11,가성비가 좋지는 않지만 음식 맛은 무난해서 종종 가던 곳인데 주문하지도 않았던 메뉴가 계산되어 여쭤보니 남직원이 너무 불친절하게 내가 잘못한거마냥 짜증내며 환불해주심,4.1
13, 그때 이후로 굳이 안감,4.3
14,분위기도 좋고 다양한 막걸리가 많아서 좋아요.,4.1
15,굳이 찾아올 맛,4.5
16, 서비스는 아니에요,3.7
17,과일막걸리는 맛있어서 막걸리 별로 안 좋아하는 친구도 잘 마실 정도음식은 양이 적은 것처럼 느껴질 수 있지만 정갈하게 잘 나와서 만족,3.5
18,과일막걸리 짱맛탱... 술 맛 하나도 안나요 술찌도 혼자 500 하나는 충분히 비울 수 있음,4.0
19,맛있어요 !,2.7
20,음식 갖다주는데 말 한마디도 없고 걍 놔두고감 주문하는데 못알아들어서 눼? 하면서 인상 찌푸림 ㅋㅋ 진심 서비스 마인드 역대급 (젊은남자) 기분 잡쳐서 대충 먹고 나옴 다신안감,5.0
21,오우..직원이 다 남자밖에 없었는데 대박 불친절장난아님ㅋㅋㅋㅋㅋㅋㅋㅋ가격 대비 양 창렬,4.2
22,막걸리를 좋아하는 편이 아니어서 평가는 안하겠음. 친구는 맛있다고 함. 막걸리 중 포도 막걸리가 제일 ㄱㅊ자리가 프라이빗하고 별로 안 시끄러워서 좋음. 온도도 딱 맞. 짬뽕탕 - 맛있음. 재료도 많이 들어가서 추천.육회 - 앵간직원 친절도 - 앵간,4.7
23,1. 자두 막걸리 (사실이게압도적),3.5
24, 딸기바나나우유막걸리만 드세여.. 딴 막걸리는 개인차 있겠으나 다 가성비 그닥이였음2. 안주 두부김치가 제일 맛있습니다ㅜㅜ 꼭 이거 드세요 딴건 시키지마세요ㅠㅠ 노맛임 딴건,2.8
25,과일막걸리땡길때 가는곳근데 웨이팅이 노답,3.5
26,두 번 정도 방문했는데 모두 최악의 기억으로 주변에 절대 가지말라고 신신당부합니다. 입구에서 신분증 검사하는 나이 많은 직원있는데 정말 너무 불친절합니다. 신분증없는 남자는 그냥 들어가라고 하고 신분증 없는 여자는 신분증 가져오라고 합니다. 장난하세요? 선택적으로 검사하는 주제에 띠껍게 굴지마세요.,4.0
27,오로지 막걸리만 괜찮음안주는 죄다별로연어는 너무 비려서 손도 못댓구요해물파전에 해물은 어디잇엇는지...파만 질겅질겅 씹은기억뿐.맛은 평균 이하엿어요왜 줄서서 먹는지 모르겟는 집...재방문의사 없습니다,3.5
28,점심메뉴 저렴하긴한데 딱 그정도의 맛,4.2
29,한식으로 이정도밖에 못하다니 ㅠㅜ,2.9
30,막걸리 시킨지 15분정도 지나서 2층 담당 안경 쓴 남직원한테 막걸리 시켰는데 주문 들어갔냐니까 0.5초만에 들어갔다고 대답함. 그러고 나선 막걸리가 10초만에 나옴....^^? 안들어간거아닌가 하는 합리적의심이 들고 여러모로 상당히 불친절. 음식은 1시간 기다리고 들어가서 그런지 그냥 그랬음,3.9
31,데이트하기 좋아여,4.2
32,딸바우막 ,3.7
33, 전 두가지를 먹어봤는데 둘다 추천합니다 굳,2.8
34,사장인지 직원인지 남자 왜 반말하냐? 이런게 진짜 광기냐?,3.7
35,막걸리 존맛탱 ㅋㅋㅋㅋ,3.8
36,여기 막걸리 종류 진짜 많고 특히 칵테일 막걸리들 맛있어서 쭉쭉넘어갑니닼ㅋㅋㅋ 전 먹어본거중에 자두막걸리가 제일 맛있었습니다,3.7
37,맛있는 한식을 먹을 수 있음 인테리어나 분위기도 너무 좋음 청포도 막걸리 진짜 맛있다 낮보다는 밤에오면 더 분위기 있을듯,3.0
38,9호선 신논현역 근처 르메르디앙 서울 호텔 아래쪽 골목에 위치한 모던한 분위기의 막걸리 전문점입니다. 구조를 보니 가정집을 개조한 듯한데,5.0
39, 인테리어와 분위기는 괜찮은 편입니다. 그런데 독특하게 젊은 여성분들끼리 온 테이블이 거의 반이 넘는 것 같습니다. 이유는 메뉴판을 보고 알았는데 다양한 종류의 칵테일 막걸리가 있는데,4.7
40, 맛도 젊은 여성이나 외국인 취향 저격의 달콤한 막걸리들입니다. 하지만 막걸리 매니아들이 좋아할 만한 맛은 아닌 것 같습니다. 안주류도 깔끔하고 맛있는데 오뎅탕이 추천할 만하고 떡갈비도 맛있었습니다. 벌교꼬막무침은 보통의 꼬막무침처럼 새콤한 맛이 거의 없으며,5.0
41, 꼬막의 신선도는 다소 아쉬웠습니다. 한방보쌈은 고기는 괜찮은 편이지만 너무 미지근하게 나오고 썰은 크기가 다소 커서 먹기도 불편했습니다. 조금 더 얇고 작게 썰고 더 따뜻하게 데워서 나와야 할 듯합니다. 작은 고체연료에 얹어서 따뜻함을 유지하게 해주면 훨씬 좋을 것 같습니다. 그리고 직원들의 무뚝뚝한 표정과 성의없는 응대는 개선이 절실히 필요합니다.,4.3
42,남직원 역대급 싸가지알바할사람이 그렇게 없나 ?어떻게 저런사람을 쓰는지 ..,2.5
43,막걸리에 전을 먹는다면 가성비가 나쁘지 않은 집. 시끄럽고 예약단체는 시간제한 있습니다,3.7
44,뭐가 특별한지 모르겠다.,3.7
45,비오는 날 막걸리먹으러갔다가 눈물에서 비가내렸다파전이 아니라 파볶음을 먹었다,3.4
46,별 0개가없는게 아쉬움 이걸 본다면 제발 가지말길,2.7
47,맥주에서 날파리 두번나옴 가지마세요,3.2
48,막걸리는 괜찮은데 안주 별로...,4.0
49,다양한 막걸리를 맛 볼 수 있고,2.3
50, 음식도 맛있습니다. 가성비를 따진다면 추천드리지 않습니다. 깔라만씨 막걸리,4.3
51, 딸기우유 막걸리 등을 먹어봤는데,3.5
52, 역시 막걸리는 장수막걸리가 맛있네요 :)개인적 평가이므로 참고만 하세요!,3.9
53,별로...,1.0
54,좀 늦게가긴했지만 그래봣자 10시였는데 짬뽕없어 전없어 결국 오뎅탕이랑 치즈 짜파게티 시켰어요. 알바생 너무 싸가지없어서 쪼금 삔또 상햇지만 우동사리 서비스 줘서 넘어가는걸루.. 맛은 있눈데 이 가격값은 아닌거같아요 특히 짜파게티.. 아 수박막걸리는 진짜 맛잇었어요 술 잘드시는 분들은 소주 시켜서 타서 드시면 더 맛잇게 드실수 있을거같아여 ㅎ,3.7
55,보쌈고기가 수분기가 없고 매우 질깁니다.부추소스는 달기만하고 매력이 없습니다.테이블에 기본적인 티슈조차 충분치 못하고물통에선 물이 줄줄샙니다.전혀 즐거운 경험이 아니였습니다.,3.0
56,Makguli,3.3
57,2017.06.15,4.6
58,이번 회사 회식장소는 요기!안주랑 막걸리들 전반적으로 맛남망고랑 청포도 바나나우유 막걸리 괜춘종류별로 과일막걸리 다 먹어보네ㅋㅋ분위기도 운치 있어서 좋았다^^,3.8
59,무월 막걸리 강추에요~^^다른 안주들도 맛있고 분위기도 좋아요,4.8
