,document,score,review_score,most_words,Pos_Neu_Neg
0,친구가 가자고 해서 간거라 별 기대없이 갔는데 맛은 생각하는 그 맛이고 고기는 조금 질겼다 두 명이서 두 메뉴를 시키고 무한리필이라는 레드밥까지 크림소스와 비벼 먹었는데 조금 부족했다 처음부터 크림소스가 적어 밥도 많이 비벼먹지 못한다 배부르게 먹고 싶다면 인원수에 +1 해서 메뉴를 시켜야 할 것 같다 직원들도 그다지 친절하지 않음,3.0,0.4538,"[('맛', 2), ('조금', 2), ('두', 2), ('메뉴', 2), ('밥', 2), ('크림소스', 2), ('친구', 1), ('별', 1), ('기대', 1), ('생각', 1)]",중립
1,강남역에 있는 바비레드는 데이트코스로 좋습니다. 일단 여자친구들이 좋아할 만한 인테리어와 메뉴구성을 가지고 있는 바비레드... 물론 맛도 수준급입니다. 일단 비주얼에 많은 신경을 쓰는 것 같았는데~ 이런게 인기비결이라고 할 수 있습니다. 중요한점은 이 비주얼이 여자친구들이 좋아할 만한 비주얼이라는 점~ㅋㅋㅋ 그리고 남자친구들에게 좋은점은 다른 곳보다는 저렴한 비용으로 맛있는 음식을 먹을 수 있다는 점입니다~ 저도 연애 당시에는 좀 다녔습니다~ 지금은 결혼해서 자주는 못가지만...,4.0,0.2115,"[('점', 4), ('비주', 3), ('얼', 3), ('있는', 2), ('바비', 2), ('레드', 2), ('일단', 2), ('여자친구', 2), ('좋아할', 2), ('만', 2)]",부정
2,정말 밥이 붉은색이더라구요. 음 그냥 먹을만했어요 특별히 맛있는것도 맛없는 것도 아니었고 무난무난. 음 그런데 뭔가 다 따로 노는 듯한 느낌? 밥시간 비켜가니까 손님은 없었어요. 재방문은 글쎄요..,4.0,0.3103,"[('밥', 2), ('음', 2), ('무난', 2), ('정말', 1), ('붉', 1), ('은색', 1), ('더라구요', 1), ('그냥', 1), ('특별히', 1), ('맛있는것도', 1)]",부정
3,매운맛은 괜찮지만 들어간 고기질은 좀 떨어집니다. 질긴 냉동 수입갈비의 맛. 아주 맛있다고 할순 없겠네요 고기질만 올린다면 괜찮을듯~ 매운강도 1~5에서 선택할수 있고 매운 것을 못 먹는다면 2 이하를 선택하세요~,3.0,0.7204,"[('매운', 3), ('맛', 2), ('기질', 2), ('선택', 2), ('괜찮지만', 1), ('좀', 1), ('냉동', 1), ('수입', 1), ('갈비', 1), ('아주', 1)]",긍정
4,아 또 먹고싶어요… 진짜 꿀맛,5.0,0.9319,"[('또', 1), ('진짜', 1), ('꿀맛', 1)]",긍정
5,"바비레드에서파는 메뉴는 맛없는게없는듴ㅋㅋㅋㅋㅋㅋ 여럿이가서 다양히먹는게 훨씬좋긴한데, 대부분 메뉴에 고기오 ㅏ밥이기본적으로나오기에 어느걸시켜도 배고프진않다는건 장담해드림ㅋㅋㅋㅋㅋㅋㅋ",3.0,0.7533,"[('메뉴', 2), ('바비', 1), ('레드', 1), ('맛없는게', 1), ('없는', 1), ('듴', 1), ('여럿', 1), ('다양히', 1), ('좋', 1), ('대부분', 1)]",긍정
6,매운거 좋아해서 가끔가요ㅎㅎ 다른매운맛집보다 파스타랑 스테이크먹으면서 분위기좋은데 맛있게 매워서 더 좋아요ㅎㅎ,4.0,0.987,"[('매운거', 1), ('좋아해서', 1), ('가끔', 1), ('가요', 1), ('운', 1), ('맛집', 1), ('파스타', 1), ('스테이크', 1), ('분위기', 1), ('좋은데', 1)]",긍정
7,노래도 빵빵하고 시끌벅적한 분위기 ㅋ,3.0,0.9038,"[('노래', 1), ('빵빵', 1), ('시끌벅적한', 1), ('분위기', 1)]",긍정
8,매운거 잘못먹는데 1단계보다 2단계가 더맛있어요 국물이 진짜 끝내줌 *_*,5.0,0.8886,"[('단계', 2), ('매운거', 1), ('더', 1), ('맛있어요', 1), ('국물', 1), ('진짜', 1), ('끝내줌', 1)]",긍정
9,레드갈릭밥스타 밥도먹고싶도 파스타도먹고싶을때 진짜 짱짱인 메뉴같아요~!!!!,4.0,0.9847,"[('밥', 2), ('레드', 1), ('갈릭', 1), ('스타', 1), ('파스타', 1), ('때', 1), ('진짜', 1), ('짱짱', 1), ('메뉴', 1), ('같아요', 1)]",긍정
10,레드갈릭스튜에 쫌있는 그국물에 밥비벼먹으면 진짜 완전 맛나요 ㅠ.ㅠ,3.0,0.919,"[('레드', 1), ('갈릭', 1), ('스튜', 1), ('쫌있는', 1), ('국물', 1), ('밥', 1), ('진짜', 1), ('완전', 1), ('맛', 1), ('요', 1)]",긍정
11,밥비비면 비주얼은 별로지만 맛은 정말 중독적인맛을 가져오는 밥으로 완성이되요 >_<,5.0,0.9785,"[('밥', 2), ('맛', 2), ('비비', 1), ('비주', 1), ('별로', 1), ('정말', 1), ('중독', 1), ('완성', 1)]",긍정
12,레드 토마토파스타.. 갈비도 들어있고 !!!! 갈비스튜의 크림파스타버전이라고해야하나 ㅋㅋㅋ어쨋든 존맛,4.0,0.9524,"[('파스타', 2), ('갈비', 2), ('레드', 1), ('토마토', 1), ('스튜', 1), ('크림', 1), ('버전', 1), ('어쨋', 1), ('존맛', 1)]",긍정
13,손님이 워낙 많아서 음식나오는데 좀기다려야해요 ㅋㅋㅋㅋ,5.0,0.9608,"[('손님', 1), ('워낙', 1), ('많아서', 1), ('음식', 1), ('좀', 1), ('야해요', 1)]",긍정
14,소개팅 자리로도 독특하고 좋을것같아요ㅋㅋㅋㅋ 분위기도 괜찮고 음식도 깔끔하고좋아요 어색한 소개팅자리는 바비레드같은 재밌는 레스토랑이 딱이지요,5.0,0.9782,"[('소개팅', 2), ('자리', 1), ('도', 1), ('독특하고', 1), ('좋을것', 1), ('같아요', 1), ('분위기', 1), ('괜찮고', 1), ('음식', 1), ('깔끔하고', 1)]",긍정
15,밥비빌때 밥반 김반으로 해야 맛있어요 최고최고 엄지척b,4.0,0.9792,"[('최고', 2), ('밥', 1), ('때', 1), ('밥반', 1), ('김반', 1), ('맛있어요', 1), ('엄지', 1), ('척', 1)]",긍정
16,밥 비벼먹는 독특한 파스타와 스테이크집 ^^,5.0,0.9044,"[('밥', 1), ('독특한', 1), ('파스타', 1), ('스테이크', 1), ('집', 1)]",긍정
17,카운터에서 주문하기전에 바비레드 홈페이지에 가입하면 5프로 적립가능!!! 요런건 써먹어야징!~!,5.0,0.2889,"[('카운터', 1), ('주문', 1), ('바비', 1), ('레드', 1), ('홈페이지', 1), ('가입', 1), ('프로', 1), ('적립', 1), ('가능', 1), ('건', 1)]",부정
18,물병이 코르크마개에 닫혀있는게 몬가 물을 따르는건데 고급진느낌이들어서 있어보여요오~~,4.0,0.6532,"[('물병', 1), ('코르크', 1), ('마개', 1), ('몬', 1), ('물', 1), ('고급', 1), ('진', 1), ('느낌', 1), ('있어', 1), ('오', 1)]",중립
19,추가금액을 낼경우 면곱배기나 치즈곱배기도 가능해요 ㅎㅎ,5.0,0.9177,"[('배기', 2), ('추가', 1), ('금액', 1), ('낼', 1), ('경우', 1), ('면곱', 1), ('치즈', 1), ('곱', 1), ('가능해요', 1)]",긍정
20,"매운정도를 조절할 수 있고, 주문할때 설문조사? 같은거 하는데 좀웃김ㅋㅋㅋㅋ처음온건지 두번째로 온건지 질문사항이 몇 개 있당",4.0,0.397,"[('온건', 2), ('매운정도', 1), ('조절', 1), ('수', 1), ('있고', 1), ('주문', 1), ('때', 1), ('설문조사', 1), ('같은거', 1), ('좀', 1)]",중립
21,바비레드.. 식당 이름이 특이하다 싶었는데…. 밥이레드색이라 그렇데요 ㅎㅎ,5.0,0.8145,"[('레드', 2), ('바비', 1), ('식당', 1), ('이름', 1), ('특이하다', 1), ('밥', 1), ('색', 1), ('그렇데요', 1)]",긍정
22,크림파스타 맛있어요. 컬러가 순해 보이는데 은근 진한 맛임 캬 캬,4.0,0.9926,"[('캬', 2), ('크림', 1), ('파스타', 1), ('맛있어요', 1), ('컬러', 1), ('순해', 1), ('은근', 1), ('진한', 1), ('맛임', 1)]",긍정
23,취향대로 매운맛을 선택할수있어서 좋네요 :-D,3.0,0.8987,"[('취향', 1), ('매운', 1), ('맛', 1), ('선택', 1), ('좋네요', 1)]",긍정
24,밥이빨개서 밥이레드 바비레드…. 맞나??? 히히히히….,3.0,0.4806,"[('밥', 2), ('레드', 2), ('이빨', 1), ('바비', 1), ('히히히', 1)]",중립
25,양념맛있다고 양념 다먹지마세요 밥을 꼭꼭비벼서 먹어야해용,4.0,0.9779,"[('양념', 2), ('맛있다고', 1), ('밥', 1), ('꼭꼭', 1), ('야해용', 1)]",긍정
26,스테이크 시켰는데 살치살로 먹음직스럽게 나와요. 야채랑 같이 먹으면 더 맛있어요.,5.0,0.8641,"[('스테이크', 1), ('살로', 1), ('먹음', 1), ('직', 1), ('야채', 1), ('더', 1), ('맛있어요', 1)]",긍정
27,시원한 음료가 땡겨서 블루베리에이드랑 애플망고 애이드 먹었어요. 시원하고 달콤한 맛이 good!!,5.0,0.9412,"[('이드', 2), ('시원한', 1), ('음료', 1), ('블루베리', 1), ('애플', 1), ('망고', 1), ('애', 1), ('시원하고', 1), ('달콤한', 1), ('맛', 1)]",긍정
28,오랜만에 갔더니 2인세트 4인세트도 생겼네요 +o+,5.0,0.6441,"[('인', 2), ('세트', 2), ('만', 1)]",중립
29,지하 자리로 안내받아 갔는데 지하도 나름 특색있고 매력있어요.,5.0,0.9519,"[('지하', 1), ('자리', 1), ('지하도', 1), ('나름', 1), ('특색', 1), ('있고', 1), ('매력', 1), ('있어요', 1)]",긍정
30,김과 밥을 리필해서 먹을수있어서 가격이 꽤 괜찮게 느껴집니다 .,4.0,0.9583,"[('김', 1), ('밥', 1), ('리필', 1), ('가격', 1), ('꽤', 1), ('괜찮게', 1)]",긍정
31,여기도 역시..웨이팅이 장난아니다!! 음식의 양은 넉넉한편은 아닌거같은데ㅋㅋㅋㅋㅋㅋ뭐 밥비며먹으면되니까 패스,5.0,0.4585,"[('여기', 1), ('역시', 1), ('웨이팅', 1), ('장난', 1), ('아니다', 1), ('음식', 1), ('양은', 1), ('한편', 1), ('아닌거', 1), ('같은데', 1)]",중립
32,"여기는 약간 특이한게 메뉴판!! 각 메뉴별로 몸무게, 성격, 특징, 인기도, 영업비용(가격)이 설명되어 있어서 메뉴 고르기에도 편하고 재밌당ㅋㅋㅋ",4.0,0.9685,"[('메뉴', 2), ('약간', 1), ('특이한게', 1), ('메뉴판', 1), ('각', 1), ('별로', 1), ('몸무게', 1), ('성격', 1), ('특징', 1), ('인기', 1)]",긍정
33,CGV 언덕길로 올라가면 있는 곳. 빨간 밥집으로 유명해요.,5.0,0.6027,"[('언덕길', 1), ('있는', 1), ('곳', 1), ('빨간', 1), ('밥집', 1), ('유명해요', 1)]",중립
34,"스튜, 스테이크, 파스타, 샐러드 등등 갖가지 음식들이 모두 맛있는 바비레드~@ 2인세트 4인세트 있어서 좀 더 저렴하게 먹을 수 있어용ㅋㅋ",4.0,0.9886,"[('인', 2), ('세트', 2), ('스튜', 1), ('스테이크', 1), ('파스타', 1), ('샐러드', 1), ('등등', 1), ('갖가지', 1), ('음식', 1), ('모두', 1)]",긍정
35,바비레드에서 레드크림파스타 먹었는데 매콤한 종류를 4가지 중에 고를 수 있어요. 저는 기본칼칼로 먹었는데 맛있었어요.,5.0,0.991,"[('레드', 2), ('바비', 1), ('크림', 1), ('파스타', 1), ('매콤', 1), ('종류', 1), ('가지', 1), ('중', 1), ('수', 1), ('있어요', 1)]",긍정
36,파스타와 셀러드와 리코타 치즈 샐러드 시켜 배불리 먹었어요.,5.0,0.7807,"[('파스타', 1), ('셀러드', 1), ('리', 1), ('코타', 1), ('치즈', 1), ('샐러드', 1), ('배', 1), ('불리', 1)]",긍정
37,손님이 많아서 조금 기다렸어요. 대기할 수 있는 대기석도 마련해 좋으셔서 지루하지 않았어요.,4.0,0.9399,"[('대기', 2), ('손님', 1), ('많아서', 1), ('조금', 1), ('수', 1), ('있는', 1), ('석도', 1), ('마련', 1), ('좋으셔서', 1), ('지루하지', 1)]",긍정
38,"음식 다 먹고 마지막에 밥비며먹어야대영!!! 어머, 이건 꼭 먹어야댕ㅋㅋㅋㅋㅋ 김가루랑 레드밥이랑 비벼비벼",4.0,0.9511,"[('음식', 1), ('마지막', 1), ('밥비', 1), ('영', 1), ('어머', 1), ('이건', 1), ('꼭', 1), ('댕', 1), ('김', 1), ('가루', 1)]",긍정
39,좋은 사람과 함께 가고 싶은 곳 이에요. 맛도 좋고 분위기도 좋고.,5.0,0.9697,"[('좋고', 2), ('좋은', 1), ('사람과', 1), ('곳', 1), ('맛', 1), ('분위기', 1)]",긍정
40,여기 파스타 소스가 찰져서 수저로 퍽퍽 퍼먹었던 기억이…,4.0,0.8567,"[('여기', 1), ('파스타', 1), ('소스', 1), ('수저', 1), ('퍽퍽', 1), ('퍼', 1), ('기억', 1)]",긍정
41,"추가금액을 낼 경우에는 면 곱빼기, ㅊ치즈 곱빼기도 가능하니까 주문하실때 참고하세용 호홋",4.0,0.5253,"[('곱빼기', 2), ('추가', 1), ('금액', 1), ('낼', 1), ('경우', 1), ('면', 1), ('치즈', 1), ('가능하니까', 1), ('주문', 1), ('때', 1)]",중립
42,테이스티로드에 나온 매운 파스타로 유명한 집! 요즘 테로가 대세네요! 나오기만 하면 유명해 집니다 !!,5.0,0.9615,"[('테이스티로드', 1), ('매운', 1), ('파스타', 1), ('유명한', 1), ('집', 1), ('요즘', 1), ('테로', 1), ('유명해', 1)]",긍정
43,"카운터에서 주문하면 경광등을 주는데, 이걸 테이블에 올려놓으면 직원이 음식을 알아서 갖다준당~ㅋㅋㅋㅋㅋ근데 경광등 꺼놓으면 음식 다 나온줄알고 안올거에요ㅋㅋㅋ",4.0,0.14,"[('광등', 2), ('음식', 2), ('카운터', 1), ('주문', 1), ('걸', 1), ('테이블', 1), ('직원', 1), ('알', 1)]",부정
44,레드크림파스타랑 바비스테이크랑 리코타치즈샐러드!!! 4명이서 이렇게 시켜먹었는데 배불러쥭는쥴ㅋㅋㅋㅋㅋ밥까지비벼먹음. 역시 한국인은 밥힘,5.0,0.9781,"[('레드', 1), ('크림', 1), ('파스타', 1), ('바비', 1), ('스테이크', 1), ('리코', 1), ('치즈', 1), ('샐러드', 1), ('명', 1), ('이서', 1)]",긍정
45,강남 바비레드! 1층과 반지하로 이루어져있어서 약간 독특행ㅋㅋㅋ이태원같은느낌도있고 자유로운느낌~,4.0,0.8932,"[('느낌', 2), ('강남', 1), ('바비', 1), ('레드', 1), ('층', 1), ('반지하', 1), ('약간', 1), ('독특', 1), ('행', 1), ('이태원', 1)]",긍정
46,바비스테이크 맛있어요. 먹기좋은 크기로 잘라 나와요,5.0,0.9527,"[('바비', 1), ('스테이크', 1), ('맛있어요', 1), ('먹기', 1), ('좋은', 1), ('크기', 1)]",긍정
47,맛은 낫베드 양이 좀 적은편 - 근데 분위기가 너무 어수선 & 정신 없어......,3.5,0.0214,"[('맛', 1), ('낫', 1), ('베드', 1), ('양', 1), ('좀', 1), ('편', 1), ('분위기', 1), ('어', 1), ('수선', 1), ('정신', 1)]",부정
48,분위기가 정신없두 맛도 그냥 그렇다 파스타 먹구 밥 비벼먹는 아이디어는 좋으나 어린 애들이 가기 딱 좋은 곳 같은 느낌? 가격 저렴,3.5,0.2568,"[('분위기', 1), ('정신', 1), ('없두', 1), ('맛', 1), ('그냥', 1), ('그렇다', 1), ('파스타', 1), ('밥', 1), ('아이디어', 1), ('좋으나', 1)]",부정
49,리코타 샐러드 시켰는데 몽글몽글한 치즈가 넘 이쁘고 야채와 조화롭게 어울려요,4.0,0.9686,"[('리', 1), ('코타', 1), ('샐러드', 1), ('몽글몽글한', 1), ('치즈', 1), ('이쁘고', 1), ('야채', 1), ('조화롭게', 1)]",긍정
50,여기진짜 밥배는 따로 놔둬야함 ㅋㅋㅋ 파스타 다먹고나서 셀프바가서 밥이랑 김가루 가져와서 비벼먹어야해요 그래야 후회안함ㅋㅋㅋㅋ,4.0,0.9303,"[('밥', 2), ('여기', 1), ('진짜', 1), ('야함', 1), ('파스타', 1), ('셀프', 1), ('바', 1), ('김', 1), ('가루', 1), ('야해요', 1)]",긍정
51,여기 특이하게 밥이 빨갛게 나와요 ㅎㅎ 특이함,4.0,0.8641,"[('여기', 1), ('특이하게', 1), ('밥', 1), ('빨갛게', 1), ('특이함', 1)]",긍정
52,리코타 치즈 샐러드 먹었어요. 바비레드에서 직접 만든다고 하네요.. 맛있어요.,4.0,0.8828,"[('리', 1), ('코타', 1), ('치즈', 1), ('샐러드', 1), ('바비', 1), ('레드', 1), ('직접', 1), ('맛있어요', 1)]",긍정
53,매운맛을 조절할 수 있어서 너무 좋음! 전 개인적으로 레드크림파스타가 제일 맛있었어요!,5.0,0.995,"[('매운', 1), ('맛', 1), ('조절', 1), ('수', 1), ('있어서', 1), ('좋음', 1), ('전', 1), ('개인', 1), ('레드', 1), ('크림', 1)]",긍정
54,취향대로 골라먹을 수 있는 곳이라서 좋은 것 같당ㅎㅎㅎㅎ 근데 결정장애인 난…. 고르는데 10분걸릴뿐이고!!!!,4.0,0.8571,"[('취향', 1), ('수', 1), ('있는', 1), ('곳', 1), ('좋은', 1), ('것', 1), ('같당', 1), ('결정', 1), ('장애인', 1), ('난', 1)]",긍정
55,셀프바가 있는데 문구가 엄청웃기당ㅋㅋㅋ이때이용하세요. 가보면 이게 무슨말인지 알거에요,5.0,0.8439,"[('셀프', 1), ('바', 1), ('있는데', 1), ('문구', 1), ('웃기', 1), ('때', 1), ('용하세요', 1), ('이', 1), ('말', 1)]",긍정
56,가볼만했던 것 같다,3.0,0.261,"[('것', 1), ('같다', 1)]",부정
57,피클.무.밥은 셀프무려제공. 레드크림파스타에 밥을 살짝 비벼먹어보세효~,3.5,0.8992,"[('밥', 2), ('피클', 1), ('무', 1), ('셀프', 1), ('무려', 1), ('제공', 1), ('레드', 1), ('크림', 1), ('파스타', 1), ('살짝', 1)]",긍정
58,포케스트에 등록된 '미국음식점'이란 분류...ㅎㅎ...미국음식점????..확실하게 그건 아닌거 같은데...???...ㅎㅎㅎㅎㅎ,4.0,0.9295,"[('미국', 2), ('음식점', 2), ('포케스트', 1), ('등록', 1), ('이란', 1), ('분류', 1), ('확실하게', 1), ('아닌거', 1), ('같은데', 1)]",긍정
59,기분좋게 잘 먹고 왔습니다.,3.0,0.958,"[('기분', 1), ('좋게', 1)]",긍정
60,Red galbi stew 가 특이해 보임,3.5,0.2898,"[('특이해', 1), ('보임', 1)]",부정
61,더치커피가 매운스파게티가 맛있는 곳  복층구조의    카페겸 레스토랑,3.5,0.9448,"[('더치커피', 1), ('매운', 1), ('스파게티', 1), ('맛있는', 1), ('곳', 1), ('복층', 1), ('구조', 1), ('카페', 1), ('겸', 1), ('레스토랑', 1)]",긍정
62,레드갈비스튜는 2단계 매운 스파게티 1단계면 눈물콧물 충분합니다. 스튜에 비벼먹을 수 있는 잡곡밥과 양념김이 무한리필이예요!,3.5,0.9788,"[('스튜', 2), ('단계', 2), ('레드', 1), ('갈비', 1), ('매운', 1), ('스파게티', 1), ('눈물', 1), ('콧물', 1), ('충분합니다', 1), ('수', 1)]",긍정
63,메뉴 주문 후 선결제. 셀프. 와인병에 물이 들어잇어서 귀요미:),3.5,0.899,"[('메뉴', 1), ('주문', 1), ('후', 1), ('선', 1), ('결제', 1), ('셀프', 1), ('와인', 1), ('병', 1), ('물이', 1), ('귀요미', 1)]",긍정
0,맛잇어요,5.0,0.8332,"[('맛', 1)]",긍정
1,마시써욥,4.0,0.6774,"[('욥', 1)]",긍정
2,그냥 싸고 양많아서 별점이 높은가 난 시끄럽고 맛없고 별로였음,2.0,0.0016,"[('그냥', 1), ('양', 1), ('많아서', 1), ('점', 1), ('높은가', 1), ('난', 1), ('시끄럽고', 1), ('맛없고', 1), ('별로', 1)]",부정
3,무난하게 맛있어요,5.0,0.9319,"[('무난', 1), ('맛있어요', 1)]",긍정
0,바로 맞은편 건물 5층으로 이전하면서 간판이 잘 안보이는데 공간이 훨씬더 고급스럽고 우와해 졌다. 잘 엄선된 코스요리를 정성것 서빙한다. 음식도 가격도 꽤 좋은 편이다.,5.0,0.915,"[('바로', 1), ('맞은편', 1), ('건물', 1), ('층', 1), ('이전', 1), ('간판', 1), ('공간', 1), ('더', 1), ('고급스럽고', 1), ('해', 1)]",긍정
1,음식다먹고 커피마시는데 쉐프님께서 직접오셔서 인사도해주시고 음식에 관해서 물어봐주셔서 몬가 귀한손님이된느낌들었어요,4.0,0.8827,"[('음', 1), ('커피', 1), ('쉐프', 1), ('직접', 1), ('인사', 1), ('해주시', 1), ('음식', 1), ('관해', 1), ('몬', 1), ('손님', 1)]",긍정
2,"조미료 사용을 최대한 절제한듯, 맛있어요",3.0,0.8531,"[('조미료', 1), ('사용', 1), ('최대한', 1), ('절제', 1), ('듯', 1), ('맛있어요', 1)]",긍정
3,다소 클래식하고 구성도 다소 단조로울수있지만 에오만의 느낌인거같아서 괜찮아요,5.0,0.8081,"[('다소', 2), ('클래식', 1), ('구성', 1), ('단조로울수있지만', 1), ('오만', 1), ('느낌', 1), ('같아서', 1), ('괜찮아요', 1)]",긍정
4,A코스와 B코스가 나뉘는데 B코스가 좀더 좋은재료를 사용하는거래요^^,4.0,0.308,"[('코스', 3), ('좀더', 1), ('좋은', 1), ('재료', 1), ('사용', 1)]",부정
5,조용하고 차분하면 정적인 분위기의 공간,5.0,0.959,"[('조용하고', 1), ('차분하면', 1), ('정적', 1), ('분위기', 1), ('공간', 1)]",긍정
6,음식의 퀄리티에비해 다른가게보다는 가격이 비교적 저렴?한편에 속해요~~,3.0,0.1848,"[('음식', 1), ('퀄리티', 1), ('가게', 1), ('가격', 1), ('비교', 1), ('저렴', 1), ('한편', 1), ('속', 1)]",부정
7,가격대가 싼편은아니지만 그만큼 맛도있어서 가끔 분위기 내고플때 가면 좋을듯 싶어요,4.0,0.9306,"[('가격', 1), ('대가', 1), ('편', 1), ('아니지만', 1), ('맛', 1), ('있어서', 1), ('가끔', 1), ('분위기', 1), ('내', 1), ('고플', 1)]",긍정
8,치즈도 맛있고 새우파스타랑 안심스테이크 맛있어요ㅎㅎ 후식도 마카롱도 좋아요ㅎㅎ,3.0,0.9934,"[('치즈', 1), ('맛있고', 1), ('새우', 1), ('파스타', 1), ('안심', 1), ('스테이크', 1), ('맛있어요', 1), ('후식', 1), ('마카롱', 1), ('좋아요', 1)]",긍정
9,파스타는 양을 대와 소로 주문을받아요,3.0,0.7629,"[('파스타', 1), ('양', 1), ('소로', 1), ('주문', 1)]",긍정
10,정갈하고 깔끔하면서도 적당한 양으로 편안한 코스요리가 특징이에용,3.0,0.9811,"[('정갈하고', 1), ('깔끔하면서도', 1), ('적당한', 1), ('양으로', 1), ('편안한', 1), ('코스', 1), ('요리', 1), ('특징', 1), ('용', 1)]",긍정
11,나올때 셰프님이 직접 배웅을하고 선물을주셔서 마지막까지 좋은기억으로 남게되요 ㅎ_ㅎ,4.0,0.9823,"[('때', 1), ('셰프', 1), ('직접', 1), ('배웅', 1), ('선물', 1), ('마지막', 1), ('좋은', 1), ('기억', 1), ('요', 1)]",긍정
12,조용한 분위기에서 식사를 하시고싶으실때 친절한 서비스로 대접받는 느낌을 받고싶으실때 추천,4.0,0.9835,"[('때', 2), ('조용한', 1), ('분위기', 1), ('식사', 1), ('친절한', 1), ('서비스', 1), ('느낌', 1), ('추천', 1)]",긍정
13,공간이 프라이빗으로 되어잇기때문에 다른손님들 방해없이 조용히 식사를하실수있어요 :),5.0,0.9467,"[('공간', 1), ('프라이', 1), ('빗', 1), ('때문', 1), ('손님', 1), ('방해', 1), ('조용히', 1), ('식사', 1)]",긍정
14,한우 안심구이 평타이상인듯 여자친구가 여기 너무좋아함,3.0,0.9839,"[('한우', 1), ('안심', 1), ('구이', 1), ('평타', 1), ('이상인', 1), ('듯', 1), ('여자친구', 1), ('여기', 1), ('좋아함', 1)]",긍정
15,새우파스타랑 전복구이먹었어요 맛있어맛있어ㅋ,3.0,0.9822,"[('맛있어', 2), ('새우', 1), ('파스타', 1), ('복구', 1)]",긍정
16,"해산물스프부터카르파치오,아구찜,파스타,스테이크,디저트2까지 45000원 최고",4.0,0.9312,"[('해산물', 1), ('스프', 1), ('카르파치오', 1), ('아구찜', 1), ('파스타', 1), ('스테이크', 1), ('디저트', 1), ('최고', 1)]",긍정
17,깔끔한 플레이팅과 직원들의 조용한 서비스가 식사내내 아주편안했어요 ㅋㅋㅋㅋㅋ,4.0,0.9908,"[('깔끔한', 1), ('플레이', 1), ('팅', 1), ('직원', 1), ('조용한', 1), ('서비스', 1), ('식사', 1), ('내내', 1), ('아주', 1), ('편안했어요', 1)]",긍정
18,그날그날 메뉴가달라요 예약을하면 하루전 전화와서 코스중 어떤걸 택할지 묻고 가리는식재료있는지도 물어봅니다 ㅋ,3.0,0.1817,"[('그날그날', 1), ('메뉴', 1), ('달라', 1), ('예약', 1), ('하루', 1), ('전', 1), ('전화', 1), ('코스', 1), ('걸', 1), ('택할', 1)]",부정
19,하나하나 맛있는 코스요리를 드시고싶고 프라이빗한 느낌을 원하실때가세요,5.0,0.957,"[('하나', 2), ('맛있는', 1), ('코스', 1), ('요리', 1), ('프라이', 1), ('빗', 1), ('느낌', 1), ('원하실', 1), ('때', 1), ('가세', 1)]",긍정
20,그날그날 신선한 재료로만드는 창의적인 이탈리안 요리를 맛볼수잇는 부띠크 다이닝으로 유명,5.0,0.6879,"[('그날그날', 1), ('신선한', 1), ('재료', 1), ('창의', 1), ('이탈리안', 1), ('요리', 1), ('부띠', 1), ('다이닝', 1), ('유명', 1)]",긍정
21,런치코스 매우 알차고 훌륭했었던 기억. 또 가고 싶네요!,5.0,0.9852,"[('런치', 1), ('코스', 1), ('매우', 1), ('알차고', 1), ('훌륭했었던', 1), ('기억', 1), ('또', 1)]",긍정
22,서비스가 고객을 최대한 편안하게 해주시면서 신경많이 써주셔서 좋았어요ㅎㅎ 음식도맛있어요,3.0,0.9615,"[('서비스', 1), ('고객', 1), ('최대한', 1), ('편안하게', 1), ('좋았어요', 1), ('음식', 1), ('맛있어요', 1)]",긍정
23,플레이팅도 너무 고급스럽고 맛있어요ㅎㅎ,4.0,0.9864,"[('플레이', 1), ('팅', 1), ('고급스럽고', 1), ('맛있어요', 1)]",긍정
24,몇몇요리들 빼고는 가격대비 최고에요!,5.0,0.9806,"[('요리', 1), ('가격', 1), ('대비', 1), ('최고', 1)]",긍정
25,연어도 마싯고 와인에 파스타도맛있었음,3.0,0.9568,"[('연어', 1), ('와인', 1), ('파스타', 1), ('맛있었음', 1)]",긍정
26,분위기너무좋아서 남자진구랑 잘 먹고왔습니다^^,5.0,0.9838,"[('분위기', 1), ('좋아서', 1), ('남자', 1), ('진구', 1)]",긍정
27,푸아그라 맛있음,3.0,0.9502,"[('푸아그라', 1), ('맛있음', 1)]",긍정
28,덩어리로 나오는 에피타이저 치즈 너무 조아용ㅎㅎ,5.0,0.9548,"[('덩어리', 1), ('에피타이저', 1), ('치즈', 1), ('조아용', 1)]",긍정
29,남자친구랑 기념일이라서 코스로 먹었는데 음식 다 만족! 간도 정말 적절하고 최고에요,3.0,0.997,"[('남자친구', 1), ('기념일', 1), ('코스', 1), ('음식', 1), ('만족', 1), ('간도', 1), ('정말', 1), ('적절하고', 1), ('최고', 1)]",긍정
